{"prop_language":"relay coils cable bundles catwalk rails","id":"style.zone.relay_tunnels","color_hierarchy":"teal guidance green safe pockets crimson ambush glow","visual_motif":"compressed relay interior and shortcuts","display_name":"Relay Tunnels","signage_grammar":"relay node glyphs maintenance lane markers","faction_style":"quiet maintenance systems and hidden repair routes"}
