{"prop_language":"pipes cranes stacked salvage bins","id":"style.zone.machine_silo","color_hierarchy":"cool blue path warm amber reward red danger","visual_motif":"guided industrial salvage","display_name":"Machine Silo","signage_grammar":"painted arrows machine numerals extraction chevrons","faction_style":"service robots patched with human repairs"}
