{"prop_language":"cargo nets turbines lift pallets","id":"style.zone.sky_docks","color_hierarchy":"white sky fill yellow runway cues orange risk lights","visual_motif":"open sightline freight deck","display_name":"Sky Docks","signage_grammar":"landing stripes cargo bay letters beacon arrows","faction_style":"weathered dock machines with aviation markings"}
